{
    "schema_version": 1,
    "type": "theme",
    "generated_at": "2026-10-20T03:00:00Z",
    "copyrights": {
        "defiant": {
            "notice": "Copyright 2012-2026 Defiant Inc.",
            "license": "Sample license text for the test fixture. The server copies the real text from the Wordfence Intelligence V3 feed.",
            "license_url": "https://www.wordfence.com/wordfence-intelligence-terms-and-conditions/"
        }
    },
    "attribution": "Vulnerability data: Wordfence Intelligence",
    "vulnerabilities": {
        "sample-theme": [
            {
                "id": "00000000-0000-4000-8000-000000000101",
                "title": "Sample Theme < 3.1.0 - Reflected Cross-Site Scripting (fixture)",
                "software": {
                    "type": "theme",
                    "slug": "sample-theme"
                },
                "affected_versions": [
                    {
                        "from_version": "*",
                        "from_inclusive": true,
                        "to_version": "3.1.0",
                        "to_inclusive": false
                    }
                ],
                "patched": true,
                "patched_versions": [
                    "3.1.0"
                ],
                "remediation": "Update to version 3.1.0, or a newer patched version",
                "cvss": null,
                "published": "2026-07-01T00:00:00Z",
                "reference": "https://www.wordfence.com/threat-intel/vulnerabilities/id/00000000-0000-4000-8000-000000000101"
            }
        ]
    }
}
